<?xml version="1.0" encoding="UTF-8"?>
<root xsi:noNamespaceSchemaLocation="file:///D:/XMLFeladatA5igrx/DOMParseA5igrx/XMLSchemaA5igrx.xsd" xmlns:xsi="http://www.w3.org/2001/XMLSchema-instance">
	<designok>
		<Design_id>1</Design_id>
		<design_név>Fodrászat</design_név>
		<Kép_URL>img55.png</Kép_URL>
		<Készítő_neve>Nyilas Viktor Balázs</Készítő_neve>
		<Használatok_száma>10</Használatok_száma>
		<Verzioszám>1</Verzioszám>
	</designok>
	<designok>
		<Design_id>2</Design_id>
		<design_név>Szépségszalon</design_név>
		<Kép_URL>img33.png</Kép_URL>
		<Készítő_neve>Nyilas Viktor Balázs</Készítő_neve>
		<Használatok_száma>2</Használatok_száma>
		<Verzioszám>1</Verzioszám>
	</designok>
	<designok>
		<Design_id>3</Design_id>
		<design_név>Építkezés</design_név>
		<Kép_URL>img44.png</Kép_URL>
		<Készítő_neve>Nyilas Viktor Balázs</Készítő_neve>
		<Használatok_száma>4</Használatok_száma>
		<Verzioszám>2</Verzioszám>
	</designok>
	<designok>
		<Design_id>4</Design_id>
		<design_név>ÉpítkezésII</design_név>
		<Kép_URL>img45.png</Kép_URL>
		<Készítő_neve>Nyilas Viktor Balázs</Készítő_neve>
		<Használatok_száma>4</Használatok_száma>
		<Verzioszám>2</Verzioszám>
	</designok>
	<designok>
		<Design_id>5</Design_id>
		<design_név>Pizzéria</design_név>
		<Kép_URL>img46.png</Kép_URL>
		<Készítő_neve>Nyilas Viktor Balázs</Készítő_neve>
		<Használatok_száma>4</Használatok_száma>
		<Verzioszám>2</Verzioszám>
	</designok>
	<honlap_motor>
		<Verzioszám>1</Verzioszám>
		<Komponens_verziószám>1</Komponens_verziószám>
	</honlap_motor>
	<honlap_motor>
		<Verzioszám>2</Verzioszám>
		<Komponens_verziószám>2</Komponens_verziószám>
	</honlap_motor>
	<honlap_motor>
		<Verzioszám>3</Verzioszám>
		<Komponens_verziószám>3</Komponens_verziószám>
	</honlap_motor>
	<honlap_motor>
		<Verzioszám>4</Verzioszám>
		<Komponens_verziószám>4</Komponens_verziószám>
	</honlap_motor>
	<honlap_motor>
		<Verzioszám>5</Verzioszám>
		<Komponens_verziószám>5</Komponens_verziószám>
	</honlap_motor>
	<kész_blokk_design>
		<KBlokkid>1</KBlokkid>
		<Blokk_név>D1-01</Blokk_név>
		<Melyik_design_rész_blokkja>D1</Melyik_design_rész_blokkja>
		<Cél_url>img1.png</Cél_url>
		<Design_id>1</Design_id>
	</kész_blokk_design>
	<kész_blokk_design>
		<KBlokkid>2</KBlokkid>
		<Blokk_név>D1-02</Blokk_név>
		<Melyik_design_rész_blokkja>D1</Melyik_design_rész_blokkja>
		<Cél_url>img2.png</Cél_url>
		<Design_id>2</Design_id>
	</kész_blokk_design>
	<kész_blokk_design>
		<KBlokkid>3</KBlokkid>
		<Blokk_név>D1-03</Blokk_név>
		<Melyik_design_rész_blokkja>D1</Melyik_design_rész_blokkja>
		<Cél_url>img3.png</Cél_url>
		<Design_id>3</Design_id>
	</kész_blokk_design>
	<kész_blokk_design>
		<KBlokkid>4</KBlokkid>
		<Blokk_név>D1-04</Blokk_név>
		<Melyik_design_rész_blokkja>D1</Melyik_design_rész_blokkja>
		<Cél_url>img4.png</Cél_url>
		<Design_id>4</Design_id>
	</kész_blokk_design>
	<kész_blokk_design>
		<KBlokkid>5</KBlokkid>
		<Blokk_név>D1-05</Blokk_név>
		<Melyik_design_rész_blokkja>D1</Melyik_design_rész_blokkja>
		<Cél_url>img5.png</Cél_url>
		<Design_id>5</Design_id>
	</kész_blokk_design>
	<kész_blokk_design_emailcím>
		<emailcím>a@b.com</emailcím>
		<KBlokkid>1</KBlokkid>
	</kész_blokk_design_emailcím>
	<kész_blokk_design_emailcím>
		<emailcím>b@a.com</emailcím>
		<KBlokkid>2</KBlokkid>
	</kész_blokk_design_emailcím>
	<kész_blokk_design_emailcím>
		<emailcím>c@b.com</emailcím>
		<KBlokkid>4</KBlokkid>
	</kész_blokk_design_emailcím>
	<relationship>
		<Validált>1</Validált>
		<Verzioszám>1</Verzioszám>
		<Widget_ID>1</Widget_ID>
	</relationship>
	<relationship>
		<Validált>1</Validált>
		<Verzioszám>1</Verzioszám>
		<Widget_ID>3</Widget_ID>
	</relationship>
	<relationship>
		<Validált>0</Validált>
		<Verzioszám>2</Verzioszám>
		<Widget_ID>5</Widget_ID>
	</relationship>
	<widgetek>
		<Widget_ID>1</Widget_ID>
		<Widget_neve>IconBox</Widget_neve>
		<Használatok_száma>340</Használatok_száma>
		<Widget_beállítások>Eltartás10Hatterszürke</Widget_beállítások>
	</widgetek>
	<widgetek>
		<Widget_ID>2</Widget_ID>
		<Widget_neve>SzövegBox</Widget_neve>
		<Használatok_száma>600</Használatok_száma>
		<Widget_beállítások>Eltartás10Hatternone</Widget_beállítások>
	</widgetek>
	<widgetek>
		<Widget_ID>3</Widget_ID>
		<Widget_neve>KombiBox</Widget_neve>
		<Használatok_száma>140</Használatok_száma>
		<Widget_beállítások>Eltartás10Hatterfekete</Widget_beállítások>
	</widgetek>
	<widgetek>
		<Widget_ID>4</Widget_ID>
		<Widget_neve>MegosztásFacebook</Widget_neve>
		<Használatok_száma>20</Használatok_száma>
		<Widget_beállítások>Eltartás10Hatterzöld</Widget_beállítások>
	</widgetek>
	<widgetek>
		<Widget_ID>5</Widget_ID>
		<Widget_neve>MegosztásTwitter</Widget_neve>
		<Használatok_száma>10</Használatok_száma>
		<Widget_beállítások>Eltartás10Hatterpink</Widget_beállítások>
	</widgetek>
</root>
